"apaauthors","year","title","journal","volume","number","pages","url","ncleo","nauthors","author","keywords","apacitation"
"Ding, X. P., Tay, C., Goh, S. J. & Hong, R. Y.","2023","Parental warmth moderates the relation between children's lying and theory-of-mind","International Journal of Behavioral Development","47","4","306-316","https://doi.org/10.1177/01650254231175835",2,4,"Xiao Pan Ding and Cleo Tay and Shu Juan Goh and Ryan Y. Hong","theory-of-mind, lying, parenting","Ding, X. P., <u><strong>Tay, C.</strong></u>, Goh, S. J. & Hong, R. Y. (2023). Parental warmth moderates the relation between children's lying and theory-of-mind. <i>International Journal of Behavioral Development, 47</i>(4), 306-316. <a href=""https://doi.org/10.1177/01650254231175835"" target=""_blank"">https://doi.org/10.1177/01650254231175835</a>"
"Ding, X. P., Tay, C., Chua, Y. J. & Cheng, J. K. T.","2023","Can classic moral stories with anthropomorphized animal characters promote children's honesty?","Journal of Applied Developmental Psychology","85",NA,"101498","https://doi.org/10.1016/j.appdev.2022.101498",2,4,"Xiao Pan Ding and Cleo Tay and Yu Juan Chua and Joey Kei Teng Cheng","lying, moral stories","Ding, X. P., <u><strong>Tay, C.</strong></u>, Chua, Y. J. & Cheng, J. K. T. (2023). Can classic moral stories with anthropomorphized animal characters promote children's honesty?. <i>Journal of Applied Developmental Psychology, 85</i>, 101498. <a href=""https://doi.org/10.1016/j.appdev.2022.101498"" target=""_blank"">https://doi.org/10.1016/j.appdev.2022.101498</a>"
"Tay, C. & Ding, X. P.","2022","Parental mental state talk in two contexts: Parents' cognitive sentential complements are positively associated with children's theory of mind","Cognitive Development","63",NA,"101192","https://doi.org/10.1016/j.cogdev.2022.101192",1,2,"Cleo Tay and Xiao Pan Ding","parenting, mental state talk, theory-of-mind, language","<u><strong>Tay, C.</strong></u> & Ding, X. P. (2022). Parental mental state talk in two contexts: Parents' cognitive sentential complements are positively associated with children's theory of mind. <i>Cognitive Development, 63</i>, 101192. <a href=""https://doi.org/10.1016/j.cogdev.2022.101192"" target=""_blank"">https://doi.org/10.1016/j.cogdev.2022.101192</a>"
"Sai, L., Shang, S., Tay, C., Liu, X., Sheng, T., Fu, G., Ding, X. P. & Lee, K.","2021","Theory of mind, executive function, and lying in children: a meta-analysis","Developmental Science","24","5","e13096","https://doi.org/10.1111/desc.13096",3,8,"Liyang Sai and Siyuan Shang and Cleo Tay and Xingchen Liu and Tingwen Sheng and Genyue Fu and Xiao Pan Ding and Kang Lee","theory-of-mind, executive function, lying","Sai, L., Shang, S., <u><strong>Tay, C.</strong></u>, Liu, X., Sheng, T., Fu, G., Ding, X. P. & Lee, K. (2021). Theory of mind, executive function, and lying in children: a meta-analysis. <i>Developmental Science, 24</i>(5), e13096. <a href=""https://doi.org/10.1111/desc.13096"" target=""_blank"">https://doi.org/10.1111/desc.13096</a>"
"Ding, X. P., Teo, S. L. Y. & Tay, C.","2021","The link between parental mental state talk and children's lying: An indirect effect via false belief understanding","Journal of Experimental Child Psychology","201",NA,"104990","https://doi.org/10.1016/j.jecp.2020.104990",3,3,"Xiao Pan Ding and Sherann Ler Ying Teo and Cleo Tay","parenting, mental state talk, theory-of-mind, lying","Ding, X. P., Teo, S. L. Y. & <u><strong>Tay, C.</strong></u> (2021). The link between parental mental state talk and children's lying: An indirect effect via false belief understanding. <i>Journal of Experimental Child Psychology, 201</i>, 104990. <a href=""https://doi.org/10.1016/j.jecp.2020.104990"" target=""_blank"">https://doi.org/10.1016/j.jecp.2020.104990</a>"
"Ma, W., Sai, L., Tay, C., Du, Y., Jiang, J. & Ding, X. P.","2019","Children with Autism Spectrum Disorder's Lying is Correlated with Their Working Memory But Not Theory of Mind","Journal of Autism and Developmental Disorders","49","8","3364-3375","https://doi.org/10.1007/s10803-019-04018-9",3,6,"Weina Ma and Liyang Sai and Cleo Tay and Youhong Du and Jie Jiang and Xiao Pan Ding","lying, executive function, theory-of-mind, autism spectrum","Ma, W., Sai, L., <u><strong>Tay, C.</strong></u>, Du, Y., Jiang, J. & Ding, X. P. (2019). Children with Autism Spectrum Disorder's Lying is Correlated with Their Working Memory But Not Theory of Mind. <i>Journal of Autism and Developmental Disorders, 49</i>(8), 3364-3375. <a href=""https://doi.org/10.1007/s10803-019-04018-9"" target=""_blank"">https://doi.org/10.1007/s10803-019-04018-9</a>"
